{
  "$schema": "http://json-schema.org/draft-07/schema#",
  "$id": "https://cortex.local/schemas/project-memory.json",
  "title": "Project Memory",
  "description": "Structured project memory — single source of truth for agents across sessions.",
  "type": "object",
  "required": ["project", "ideas", "research", "decisions", "pain_points", "links"],
  "additionalProperties": false,
  "properties": {
    "project": {
      "type": "object",
      "required": ["id", "name", "description", "for", "status", "created_at", "updated_at"],
      "additionalProperties": false,
      "properties": {
        "id": { "type": "string", "pattern": "^[a-z0-9-]+$" },
        "name": { "type": "string", "minLength": 1 },
        "description": { "type": "string" },
        "for": { "type": "string" },
        "status": { "type": "string", "enum": ["active", "paused", "complete", "archived"] },
        "created_at": { "type": "string", "format": "date-time" },
        "updated_at": { "type": "string", "format": "date-time" }
      }
    },
    "ideas": {
      "type": "array",
      "items": {
        "type": "object",
        "required": ["id", "content", "status", "created_at"],
        "additionalProperties": true,
        "properties": {
          "id": { "type": "string" },
          "content": { "type": "string" },
          "supersedes": { "type": ["string", "null"] },
          "superseded_by": { "type": ["string", "null"] },
          "status": { "type": "string", "enum": ["active", "replaced", "abandoned"] },
          "verdict": { "type": "string", "enum": ["build", "validate", "kill"] },
          "brief": { "type": "object" },
          "created_at": { "type": "string", "format": "date-time" }
        }
      }
    },
    "research": {
      "type": "array",
      "items": {
        "type": "object",
        "required": ["id", "title", "summary", "created_at"],
        "additionalProperties": true,
        "properties": {
          "id": { "type": "string" },
          "title": { "type": "string" },
          "summary": { "type": "string" },
          "source": { "type": "string" },
          "tags": { "type": "array", "items": { "type": "string" } },
          "created_at": { "type": "string", "format": "date-time" }
        }
      }
    },
    "decisions": {
      "type": "array",
      "items": {
        "type": "object",
        "required": ["id", "decision", "rationale", "created_at"],
        "additionalProperties": false,
        "properties": {
          "id": { "type": "string" },
          "decision": { "type": "string" },
          "rationale": { "type": "string" },
          "created_at": { "type": "string", "format": "date-time" }
        }
      }
    },
    "pain_points": {
      "type": "array",
      "items": {
        "type": "object",
        "required": ["id", "description", "status", "created_at"],
        "additionalProperties": true,
        "properties": {
          "id": { "type": "string" },
          "description": { "type": "string" },
          "status": { "type": "string", "enum": ["open", "in_progress", "resolved"] },
          "resolution": { "type": ["string", "null"] },
          "created_at": { "type": "string", "format": "date-time" },
          "resolved_at": { "type": ["string", "null"], "format": "date-time" }
        }
      }
    },
    "links": {
      "type": "array",
      "items": {
        "type": "object",
        "required": ["project_id", "type"],
        "additionalProperties": false,
        "properties": {
          "project_id": { "type": "string" },
          "type": {
            "type": "string",
            "enum": ["learned_from", "shares_context", "depends_on", "supersedes"]
          }
        }
      }
    },
    "agent_runs": {
      "type": "array",
      "items": {
        "type": "object",
        "required": ["agent", "summary", "status", "created_at"],
        "additionalProperties": false,
        "properties": {
          "agent": { "type": "string" },
          "summary": { "type": "string" },
          "status": { "type": "string", "enum": ["success", "partial", "failed"] },
          "action_required": { "type": ["string", "null"] },
          "created_at": { "type": "string", "format": "date-time" }
        }
      }
    }
  }
}
